{
  "schema_version": "simulation_request.v1",
  "request_id": "sim_req_material_balance_minimal",
  "source_system": "autowatersimu",
  "requested_by": "user:test",
  "job_type": "simulation.material_balance.v1",
  "input_ref": {
    "simulation_input_id": "si_material_balance_minimal"
  },
  "external_refs": {}
}
