{
  "schema_version": "simulation_request.v1",
  "request_id": "sim_req_milp_material_balance_minimal",
  "source_system": "milp",
  "requested_by": "service:milp-scheduler",
  "job_type": "simulation.material_balance.v1",
  "input_ref": {
    "simulation_input_id": "si_milp_material_balance_minimal",
    "simulation_input": {
      "schema_version": "simulation_input.v1",
      "simulation_input_id": "si_milp_material_balance_minimal",
      "process_graph_id": "pg_milp_material_balance_minimal",
      "process_graph_version": 1,
      "job_type": "simulation.material_balance.v1",
      "component_schema": {
        "component_schema_id": "material_balance_components.v1",
        "components": ["COD"],
        "unit": "mg/L"
      },
      "nodes": [
        { "node_id": "n_in", "node_type": "input", "initial_volume": 1.0, "initial_concentrations": { "COD": 10.0 }, "is_inlet": true, "is_outlet": false },
        { "node_id": "n_tank", "node_type": "tank", "initial_volume": 10.0, "initial_concentrations": { "COD": 0.0 }, "is_inlet": false, "is_outlet": false },
        { "node_id": "n_out", "node_type": "output", "initial_volume": 1.0, "initial_concentrations": { "COD": 0.0 }, "is_inlet": false, "is_outlet": true }
      ],
      "edges": [
        { "edge_id": "e_in_tank", "source_node_id": "n_in", "target_node_id": "n_tank", "flow_rate": 100.0, "concentration_transform": { "COD": { "a": 1.0, "b": 0.0 } } },
        { "edge_id": "e_tank_out", "source_node_id": "n_tank", "target_node_id": "n_out", "flow_rate": 100.0, "concentration_transform": { "COD": { "a": 1.0, "b": 0.0 } } }
      ],
      "parameters": {
        "hours": 4.0,
        "steps_per_hour": 60,
        "solver_method": "scipy_solver",
        "tolerance": 0.000001
      },
      "runtime_options": {}
    }
  },
  "external_refs": {
    "site_id": "site_demo",
    "scenario_id": "scenario_milp_minimal",
    "plan_id": "plan_milp_minimal"
  },
  "metadata": {
    "trace_id": "trace_milp_material_balance_minimal",
    "tenant_id": "tenant_demo",
    "project_id": "project_demo"
  }
}
