{
  "schema_version": "simulation_request.v1",
  "request_id": "sim_req_model_run_material_balance_minimal",
  "source_system": "governance",
  "requested_by": "service:model-run-replay",
  "job_type": "simulation.material_balance.v1",
  "input_ref": {
    "model_run_id": "mr_replay_source_material_balance"
  },
  "external_refs": {
    "site_id": "site_demo",
    "scenario_id": "scenario_material_balance_replay"
  },
  "metadata": {
    "trace_id": "trace_sim_req_model_run_material_balance_minimal",
    "tenant_id": "tenant_demo",
    "project_id": "project_demo"
  }
}
